,price,weight,product_list,maker,brand,rating,review_cnt,foodtexture,id,benefits
935,33.92,4.125,natural balance delectable delights surf 'n turf grain-free wet dog food,Natural Balance,Natural Balance,5,1,stew,95650," a delicious blend of wholesome ingredients that includes animal protein and vegetables , the perfect option for a complete and balanced meal or makes a great topper for kibble , added salmon oil helps to maintain a healthy coat and skin , made without any corn, wheat or soy so dogs with food sensitivities can enjoy too , added vitamins and minerals like vitamin a and vitamin b12 help support a healthy immune system "
936,34.68,9.6,party animal cocolicious lamb & wild caught salmon recipe grain-free ,Party Animal,Party Animal,4.9,9,pate,88835," fruits, vegetables and grains provide soluble fiber to help maintain a healthy digestive system , increased calories in wet food are great for dogs recovering from illness or injury who need to gain back lost weight , omega 3 and 6 fatty acids contribute to healthy skin and luxurious coat, and calcium and phosphorus ratio helps support healthy bones and teeth , include minimally processed fruits and vegetables that provide a source of antioxidants and vitamins , made in an organically certified kitchen without corn, wheat, soy, artificial colors or preservatives with probiotics to support digestion "
937,30,9.9,solid gold sundancer 95% chicken recipe grain-free ,Solid Gold,Solid Gold,4.1,16,pate,86567," specially crafted to support weight management in adult dogs with a low calorie, low fat formula. , with high-protein chicken and chicken liver as the top ingredients for holistic, grain-free and gluten-free goodness in every meal. , supports the immune system and a healthy skin and coat with nutrient dense superfoods and vitamins and minerals. , helps your pooch feel full with high-fiber vegetables like sweet potatoes and green beans, so he can stay at his ideal weight while feeling satisfied. , made in the usa with highly-digestible ingredients and zero fillers, corn, wheat, soy, grain, gluten, carrageenan, or artificial preservatives. "
938,59.76,15,nature's recipe grain-free chicken & venison stew ,Nature's Recipe,Nature's Recipe,4.8,15,stew,68356," bolognese style dinner with minced beef and carrots for finicky small dogs. , simple, limited ingredient recipe is great for sensitive eaters. , comes in convenient single-serving trays for less mess and leftovers. , nutritious recipe is made without corn, wheat, soy or carrageenan. , made with uncompromising quality in the usa by the family-owned company. "
939,21.07,4.125,halo holistic turkey & salmon recipe adult ,Halo,Halo,4.7,31,stew,47570," produced with fresh top-quality poultry, seafood and meats, which provides a healthy source of protein for your pet , also use fresh fruits and vegetables such as blueberries, cranberries, zucchini and artichoke to name a few, which are a great source of antioxidants, fiber, vitamins and folic acid , formulated to promote clean nutrition and protection for your pets from exposure to toxins and unhealthy ingredients , made with organic beef, fruits, vegetables, vitamins &amp; minerals for overall wellbeing , no artificial preservatives, colors, flavors, corn, wheat, or soy and made with simple &amp; essential ingredients "
940,26.99,9.75,dogswell vitality chicken & sweet potato stew recipe grain-free ,Dogswell,Dogswell,4.5,11,stew,47142," inspired by the diet of the wolf and made with more of the meat dogs love , b12 supplement improves gastrointestinal function and chelated minerals improve immune system , a sensible alternative to less convenient raw diets, which often require additional supplementation to be nutritionally complete , healthy complex carbohydrates , contains real duck as the first ingredient followed by antioxidant-rich fruits and vegetables "
941,15.99,0.825,i and love and you beef booyah & moo moo venison stew grain-free combo pack ,I and Love and You,I and Love and You,4.5,2,stew,130169," high quality cuisine that provides unparalleled variety and enjoyment , formula provides complete and balanced nutrition in pate formulated for adult dogs , fortified with vitamins and minerals to help dogs of all sizes to stay healthy , savory dog food is served in convenient trays with easy, peel-away freshness seals , features delectable delicious prime rib flavor for dogs with refined tastes at any time of day "
942,39.99,5.25,nutro ultra shiny coat boost salmon pate dog food trays,Nutro Ultra,Nutro,4.7,6,pate,84683," veterinary formulated specifically for large breed dogs of all ages. , made with nutritionally dense chicken and duck for optimum protein. , premium ingredients plus added vitamins and minerals make for great-tasting nutrition. , simmered in a broth for an irresistible flavor that dogs love. , made with uncompromised quality by the family-owned company without corn, wheat or soy. "
943,19.38,0.825,instinct by nature's variety ultimate protein grain-free beef formula ,Instinct,Instinct,4.1,10,pate,120816," this complete and balanced dog food with added vitamins and chelated minerals has been formulated for pets of all life stages. , made with fresh, wholesome ingredients, like lamb and carrots. this high quality protein is easily digested and precise has left out corn, wheat, soy, beef or poultry protein, so it's a great option for pets with sensitive stomachs or that are allergic to common ingredients. , brown rice and oats provide your pet with healthy sources of carbohydrates and fiber so they have the energy they need. , chelated minerals are included which are more easily absorbed by the body and provide the correct balance of daily mineral requirements. , made in the usa! "
944,16.8,5.25,"cesar home delights grilled porterhouse steak flavor with potatoes,bacon & cheese dog food trays",Cesar,Cesar,4.2,5,pate,109802," tasty and natural grain-free duck stew steeped in a hearty gravy in easy-to-serve trays.  , real, deboned duck is the first ingredient with added vitamins and minerals. , inspired by a naturally wild diet, this protein-rich recipe caters to your dog’s inner carnivore. , made in the usa with only real ingredients and never any chicken or poultry by-product meals.  , great for allergies with no grains, corn, wheat or soy or artificial preservatives, colors or flavors. "
945,33.99,4.5,"wellness petite entrees casserole with roasted turkey,duck,carrots & peas grain-free wet dog food",Wellness,Wellness,4.8,11,minced,76683," made with natural ingredients with added vitamins and minerals and no preservatives for complete, balanced nutrition , two great recipes with quality ingredients like real turkey and chicken , each recipe is inspired by your favorite meals , serve as a meal or as a topper , made in the usa "
946,31.46,9.75,hound & gatos chicken & chicken liver formula grain-free ,Hound & Gatos,Hound & Gatos,5,9,pate,115038," developed and specially formulated to help dogs undergoing chemotherapy with a complete and balanced food that provides all the nutrition dogs need , clinically proven to help improve quality of life for dogs undergoing chemotherapy , high level of protein to meet energy demand and to avoid muscle wasting , designed with high level of fat to increase caloric density and palatability to help acceptance by inappetant pets , high level of arginine and omega-3 fatty acids to help stimulate the immune system and low levels of carbohydrates for optimal health benefits "
947,31.44,9.525,merrick backcountry grain-free chunky beef dinner in gravy ,Merrick,Merrick,4.8,4,chunks in gravy,94143," a delicious blend of wholesome ingredients that includes animal protein and vegetables , the perfect option for a complete and balanced meal or makes a great topper for kibble , added salmon oil helps to maintain a healthy coat and skin , made without any corn, wheat or soy so dogs with food sensitivities can enjoy too , added vitamins and minerals like vitamin a and vitamin b12 help support a healthy immune system "
949,43.65,10.5,weruva peking ducken with chicken & duck in gravy grain-free ,Weruva,Weruva,4.8,14,chunks in gravy,85499," made with high-quality ingredients, including real beef plus hearty vegetables. , meaty, home-style recipe has a hearty texture that delivers complete and balanced nourishment. , optimal levels of oil and minerals nourish the skin and coat for a luxurious shine. , soft texture adds flavor and variety to dog’s diets. serve it alone or mix it with kibble. , proudly made in the usa with the flavors dogs crave and the nutrition they need. "
950,38.28,9.75,wild calling rainbow river 96% salmon grain-free adult ,Wild Calling,Wild Calling,4.4,21,pate,77362," high-quality cuisine that provides unparalleled variety and enjoyment. , pate in sauce formula provides complete and balanced nutrition formulated for adult dogs. , fortified with vitamins and minerals to help dogs of all sizes, especially small breeds, to stay healthy. , savory dog food is served in convenient trays with easy, peel-away freshness seals. , features a delectable grilled chicken flavor for dogs with refined tastes at any time of day. "
951,25.92,8.25,purina pro plan savor adult classic beef & brown rice entree ,Purina Pro Plan,Purina,4.8,10,pate,67533," a delicious blend of wholesome ingredients that includes animal protein and vegetables , the perfect option for a complete and balanced meal or makes a great topper for kibble , added salmon oil helps to maintain a healthy coat and skin , made without any corn, wheat or soy so dogs with food sensitivities can enjoy too , added vitamins and minerals like vitamin a and vitamin b12 help support a healthy immune system "
952,53.54,0.825,royal canin veterinary diet mature consult formula ,Royal Canin Veterinary Diet,Royal Canin,4.5,8,pate,65211," produced with fresh top-quality poultry, seafood and meats, which provides a healthy source of protein for your pet , also use fresh fruits and vegetables such as blueberries, cranberries, zucchini and artichoke to name a few, which are a great source of antioxidants, fiber, vitamins and folic acid , formulated to promote clean nutrition and protection for your pets from exposure to toxins and unhealthy ingredients , made with organic beef, fruits, vegetables, vitamins &amp; minerals for overall wellbeing , no artificial preservatives, colors, flavors, corn, wheat, or soy and made with simple &amp; essential ingredients "
953,18.99,8.25,mighty dog with lamb & rice ,Mighty Dog,Mighty Dog,4.9,7,minced,100706," perfect to pair with sun dancer grain free dry dog food or to be fed as a standalone diet , natural, holistic grain-free &amp; gluten-free recipe , holistic food for dogs and puppies of all life stages , no corn, wheat or soy which are common allergens for dogs , no fillers, by-products, artificial coloring, flavoring or preservatives "
954,34.99,0.825,holistic select turkey & duck pate recipe grain-free ,Holistic Select,Holistic Select,4.2,8,pate,76651," highly palatable wholesome blend of grain-free ingredients in a savory gravy , made with real animal protein and no animal by-product meals , added vitamins like vitamin a and vitamin b12 help support a healthy immune system , no artificial flavors or preservatives , a 100% complete and balanced diet for dogs of all breeds "
955,17.94,0.825,instinct by nature's variety grain-free stews turkey & cod recipe wet ,Instinct,Instinct,5,3,stew,122345," sustainably-raised, cage-free turkey and wild-caught salmon are the very first ingredients in this savory canned food that also includes chicken liver and rolled oats. , wholesome, non-gmo carrots, peas, green beans and sweet potatoes provide essential antioxidants, fiber and vitamins. , complete and balanced nutrition is fortified with essential minerals and trace nutrients, including fatty acids for healthy skin and coat. , made in the usa with no grains, meat-meals, hormones or antibiotics, as well as no artificial colors, flavors or preservatives; packed in bpa-free cans for safety. , smooth, delicious texture provides additional hydration and can be used as a delicious topper over dry kibble to entice a picky eater. "
956,37.49,9.375,wellness core 95% grain-free chicken & broccoli ,Wellness,Wellness,5,2,pate,120811," chunks of cage-free chicken with antioxidant-rich fruits and veggies in a delicious sweet potato stew that's sure to please your pup , antioxidant-rich fruits &amp; veggies, like berries and spinach support overall health and wellness, while veterinarian-selected botanicals help support metabolism, strengthen organs and cleanse the body of toxins , fiber rich pumpkin and prebiotics help to support proper digestion while chelated minerals offer better nutrient absorption , crafted without grains, corn, wheat, and soy, so it's a great option for pet parents that are concerned with obesity, digestibility, and allergies , made in the usa!  "
957,13.99,0.825,blue buffalo divine delights top sirloin flavor pate dog food trays,Blue Buffalo,Blue Buffalo,5,3,pate,114282," combo pack includes two delicious recipes with meaty beef or venison in a savory veggie stew. , made with real beef as the first ingredient and venison with a hearty blend of fruits and vegetables. , provides a complete and balanced diet for dogs of all ages and enhanced with vitamins, minerals, amino acids, and salmon oil. , each can is a complete meal on its own or a delectable dry food topper for picky eaters. , made in the usa with no grain, gluten, wheat, soy, carrageenan, or artificial flavors, colors or preservatives. "
958,28.99,9.9,victor lamb & rice formula ,Victor,Victor,5,7,pate,107340," topped with real pieces of carrots and tomatoes which provides powerful antioxidants to support a healthy immune system. , high-quality, natural ingredients to deliver balanced nutrition with proven visible health benefits. formula is fortified with vitamins, minerals and trace nutrients to ensure your dog stays healthy. , formulated with optimal levels of omega-6 fatty acid (linoleic acid) and zinc to promote healthy skin and a shiny coat. help keep your pet keep looking great and robust. , made with absolutely no artificial colors, flavors or preservatives. this is a high quality product that is produced in the manufacturer's own facilities to ensure safety and quality. , nutro's dedicated team of experts tailor their formulas to your pet's life stage and health condition. they only use natural ingredients that they directly buy and can trace back to their suppliers. "
959,28.99,9.9,victor chicken & rice formula ,Victor,Victor,4.3,6,pate,107337," formulated to mirror your dog’s ancestral diet with 95% beef and liver, plus 5% vegetables, fruits, and wholesome ingredients, and 0% grain and gluten.  ,  natural ingredients with added vitamins and minerals provide complete and balanced nutrition for all life stages and breeds.  ,  includes healthy omega fatty acids to promote a soft and shiny coat.  ,  delicious texture comes in a variety of proteins that can be rotated to bring your dog great-tasting variety at the bowl.  ,  made in usa facilities with no grain, gluten, corn, wheat, soy or fillers or artificial colors, flavors or preservatives.  "
960,31.44,9.525,merrick backcountry grain-free chunky chicken dinner in gravy ,Merrick,Merrick,5,4,chunks in gravy,94145," high-quality cuisine that provides unparalleled variety and enjoyment. , pate in sauce formula provides complete and balanced nutrition formulated for adult dogs. , fortified with vitamins and minerals to help dogs of all sizes, especially small breeds, stay healthy. , savory dog food is served in convenient trays with easy, peel-away freshness seals. , features delectable steak, potato, bacon, and cheese flavors for dogs with refined tastes at any time of day. "
961,17.44,5,purina pro plan savory meals braised pork entree with real carrots wet dog food,Purina Pro Plan,Purina,5,4,chunks in gravy,83077," specially formulated to naturally meet the unique needs of small breed dogs , delicious casserole using quality ingredients like roasted turkey, duck, carrots &amp; peas , contains only premium, all natural ingredients with no wheat, meat by-products, soy or artificial colors and flavors , convenient, easy-open, ready-to-serve container makes mealtime quick and easy , complete and balanced for everyday feeding "
962,26.97,9.9,precise holistic complete chicken with vegetables formula in gravy grain-free ,Precise Holistic Complete,Precise Holistic Complete,4.2,22,pate,51107," made from high-quality chicken , 100% animal protein, this diet is an ancestrally appropriate carnivore diet , free of soy, grains and glutens, no artificial preservatives, colors or flavors , single protein source fortified with vitamins and minerals , wholesome meat with no added carbohydrates "
963,26.99,0.825,dave's pet food grain-free roasted pork & sweet potato ,Dave's Pet Food,Dave's Pet Food,4.6,20,pate,136572," hearty stew-style canned dog food with deboned beef as the #1 ingredient , ancestral canine diet packed with protein your dog craves , provides the meaty nutrition your dog needs every day , essential vitamins and minerals for complete nutrition , handcrafted in merrick’s own texas kitchen "
964,33.99,9.375,wellness core hearty cuts in gravy whitefish & salmon recipe grain-free ,Wellness,Wellness,4.2,8,chunks in gravy,95671," unique, 10 oz easy-open can is perfect for dogs who need a little less than standard. this delicious recipe features select cuts of top quality beef and wild caught salmon in au jus , all of weruva's dogs in the kitchen formulas focus on high quality protein and moderate fat for a nutritious meal your pup is sure to love , recipe contains no grains, starch, msg, gluten or carrageenan so it's ideal for any pups with sensitive tummies or allergies , contains added vitamins and minerals to make this delicious food a complete and balanced diet , suitable for all life stages, can be served as a standalone diet or as a yummy topper for dry food "
965,42.58,10.5,weruva hot dayam! with luscious lamb in gelee grain-free ,Weruva,Weruva,4.6,10,aspic / gelee,85490," gourmet, natural canned dog food with a delicious recipe featuring tender chunks of duck, chicken and pumpkin in a tasty gravy , all of weruva's dog food formulas are formulated with the carnivore in mind, so this recipe focuses on high quality protein, minimal carbs and a high moisture content for the most nutritious meal around for your pup. , recipe is grain-free, gluten-free and contain no carrageenan, so it's ideal for any pups with sensitive tummies or allergies , contains added vitamins and minerals to make this delicious food a complete and balanced diet , suitable for all life stages, can be served as a standalone diet or as a yummy topper for dry food "
967,29.99,9.6,party animal cocolicious 95% organic chicken grain-free ,Party Animal,Party Animal,4.8,8,pate,93274," 96% healthy protein-rich salmon , grain-free and gluten-free with no artificial colors, flavors or preservatives , rich in dietary fiber, iron and omega fatty acids , formulated for rotational feeding. unlike a conventional feeding plan where the same food is served at each meal, rotational feeding involves varying the menu , with added zinc, copper and iron "
968,35.88,9.75,zignature catfish limited ingredient formula grain-free ,Zignature,Zignature,5,4,pate,113250," 100% complete and balanced diet can be used on its own or as a topper and is specifically formulated to support a healthy, active lifestyle for adult dogs , savory entrée packed with real beef and brown rice provides the ultimate texture and taste your dog craves, as well as powerful antioxidants to keep them at their best , protein-rich beef, and complex carbohydrates provide plenty of energy, and vitamins and minerals boost the immune system and keep the digestive system in optimal shape , omega-6 fatty acids are included to maintain healthy skin and a beautiful shiny coat , proudly manufactured in purina-owned u.s.a facilities and does not contain any added artificial colors, flavors, or preservatives "
969,18.99,0.825,"blue buffalo homestyle chicken stew with potatoes,carrots & peas dog food trays",Blue Buffalo,Blue Buffalo,5,1,stew,114302," a balanced complex of powerful antioxidants neutralizes free radicals, protects against cell aging and supports brain function in older dogs , specific nutrient blend to help regulate intestinal transit and to help support the intestinal microflora , balanced formulation of amino acids helps maintain muscle tone and preserve muscle mass , enriched with essential nutrients to support skin cell renewal and hair growth , royal canin urinary s/o index® promotes a urinary environment unfavorable to the development of both struvite and calcium oxalate crystals "
970,13.99,0.825,blue buffalo divine delights porterhouse flavor pate dog food trays,Blue Buffalo,Blue Buffalo,5,2,pate,114273," a hearty, delicious meal with a finely ground texture that’s tailored to a small dog’s needs , specially formulated for small dogs, little pups need more protein to keep them going strong all day, and this dish is packed with it , features a full range of amino acids, vitamins and minerals to meet his unique nutritional needs , formulated to meet the nutritional levels established by the association of american feed control officials (aafco) dog food nutrient profiles for growth of puppies and maintenance of adult dogs , made without any added artificial preservatives "
971,9.87,4.95,variety pet foods homestyle stew meat lovers variety pack ,Variety Pet Foods,Variety Pet Foods,2.5,2,stew,101015," the unique grain-free can recipes provide prebiotic support and feature botanicals such as pumpkin, papaya and pomegranate , features omega 3 fatty acids from flaxseed to help promote a shiny and healthy skin &amp; coat , the botanicals, herbs and premium proteins that are used help deliver optimum, natural nutrition for daily whole-body health , contains chicory root extract to support healthy digestion , made without grains, wheat, soy, corn, artificial colors, flavors or preservatives "
972,33.99,4.5,"wellness petite entrees casserole with braised beef,salmon,green beans & red peppers grain-free wet dog food",Wellness,Wellness,4.7,15,minced,76685," high animal protein, grain-free recipe is guided by the belief in raw to unlock your dog’s potential to thrive.  ,  cuts of cage-free turkey and alaskan cod, diced carrots and spinach in savory gravy offer whole-food ingredients you can see.  ,  made with the finest ingredients from around the world, including natural omega-3 and 6 fatty acids from real foods.  ,  serve as a full meal or mix with kibble for a delicious, healthy way to add mealtime excitement.  ,  made in usa facilities with no grains, corn, wheat, soy or fillers or artificial colors, flavors or preservatives.  "
973,33.99,9.9,"castor & pollux natural ultramix beef tripe & chicken,apples & green peas entree grain-free adult ",Castor & Pollux,Castor & Pollux,4.6,17,stew,65682," provides a complete and balanced diet with a grain-free, protein-focused formula made with one single protein source and an antioxidant-rich superfood. , lean chicken for high-quality protein, broccoli for fiber and vitamin c, and ground flaxseed for omega-3 fatty acids, plus vitamins and minerals. , high-protein formula helps your pup maintain lean muscle mass and a fast metabolism, while antioxidants from real veggies improve overall wellbeing. , convenient easy-open lid makes it easy to give as a complete meal or a delicious, nutritious food topper. , contains no grain, meat by-products, wheat, corn, soy, artificial flavors, colors or preservatives. "
974,31.37,0.825,evanger's grain-free pork canned dog & cat food,Evanger's,Evanger's,4.4,25,pate,59824," specially prepared for small dogs with meaty chunks in a savory sauce in single-serving trays.  , real, deboned beef is the first ingredient with added vitamins and minerals. , inspired by a naturally wild diet, this protein-rich recipe caters to your dog’s inner carnivore. , made in the usa with only real ingredients and never any chicken or poultry by-product meals.  , completely free of corn, wheat or soy or artificial preservatives, colors or flavors. "
975,17.94,0.825,instinct by nature's variety grain-free stews turkey & duck recipe wet ,Instinct,Instinct,4,2,stew,122347," natural, wholesome recipe with added vitamins, minerals and trace nutrients to keep your pup in peak health , with premium ingredients that include lamb, vegetable broth, brown rice, egg, flaxseed, and sunflower oil , highly palatable: even the pickiest eaters will love the taste and texture of this delicious meal , supports healthy digestion, enhanced bowel function, and muscle health , omega fatty acids found in flaxseed contribute to healthy skin and a shiny, lustrous coat "
976,24.49,9.75,avoderm natural vegetarian formula adult ,AvoDerm,AvoDerm,4.9,12,pate,46690," natural, wholesome recipe with added vitamins, minerals and trace nutrients to keep your pup in peak health , with premium ingredients that include chicken, chicken broth, brown rice, egg, flaxseed, and sunflower oil , highly palatable: even the pickiest eaters will love the taste and texture of this delicious meal , supports healthy digestion, enhanced bowel function, and muscle health , omega fatty acids found in flaxseed contribute to healthy skin and a shiny, lustrous coat "
978,24.99,9.9,eagle pack turkey formula ,Eagle Pack,Eagle Pack,3.7,6,pate,47192," protein-rich stew with chunks of chicken in gravy , all-natural, grain-free recipe , provides the meaty nutrition your dog needs every day , essential vitamins and minerals for complete nutrition , handcrafted in merrick’s own texas kitchen "
