,price,weight,product_list,maker,brand,rating,review_cnt,foodtexture,id,benefits
644,17.4,9.9,pedigree choice cuts in gravy with beef & barley ,Pedigree,Pedigree,,,chunks in gravy,114198," 92% of the ingredients come from turkey, chicken and pork for a protein-rich and fuel-filled variety your dog will love. , made without corn, soy or chicken by-product and formulated to be high in protein, this meal keeps your dog full and happy. , provides the fuel necessary to bolster aerobic capacity while ensuring long-term energy. , made with absolutely no artificial colors, flavors or preservatives. this high-quality food is produced in nutro's own facilities to ensure safety and quality. , nutro's dedicated team of experts tailor their formulas to your pet's life stage and health condition. they only use natural ingredients that they directly buy and can trace back to their suppliers. "
645,26.13,9.9,"evolve nature's menu hearty stew with beef,carrots & potatoes ",Evolve,Evolve,4.5,2,chunks in gravy,79765," made with real chicken as the first ingredient in every easy-peel tray. , delicious chicken flavor in savory juices that most dogs find irresistible. , perfect as a wholesome meal, deliciously savory meal topper, or a healthy snack. , enhanced with added vitamins and minerals for a healthy, balanced diet. , contains no corn, wheat, soy, by-products, fillers, artificial colors or flavors. "
646,22.02,9.9,triumph grain-free beef & vegetable stew ,Triumph,Triumph,4.6,9,pate,79638," specially made for delicate dogs with allergies or food sensitivities who need a simpler, limited ingredient diet. , contains a single animal protein source?real lamb?plus brown rice and highly-digestible dried egg product. , enhanced with vitamins, minerals and nutrients to provide a complete and balanced diet with no artificial flavors or colors. , can be served as a complete meal or a lip-smacking topper over dry kibble to help entice a picky pup. , proudly made in new jersey, usa by a dog-loving small business with a passion for quality dog food. "
647,22.99,9.9,"triumph lamb,rice 'n vegetable formula ",Triumph,Triumph,5,4,pate,79628," free-range turkey is the number one ingredient in this protein-rich, savory stew. , chickpeas provide an excellent source of low-glycemic protein and folic acid. , made without grains, potatoes or tapioca starch for superior digestibility. , chelated minerals, omega fatty acids and antioxidants support immunity and a healthy skin and coat. , made in the usa with simple, natural ingredients you can see and no artificial colors, flavors or preservatives. "
648,31.2,0.825,nutro wild frontier grass-fed prey recipe lamb stew with liver high-protein grain-free ,Nutro,Nutro,,,stew,132093," tender turkey and green beans pate is slow-cooked to perfection. , great as a meal on its own or as a delicious topper to kibble. , potato and grain-free recipe includes vitamins and minerals. , comes in convenient, single-serving 3.5 ounce trays for less mess and leftovers. , made in the usa with uncompromising quality by the family-owned company. "
649,39.89,9.75,hound & gatos lamb formula grain-free ,Hound & Gatos,Hound & Gatos,4,2,pate,115056," 96% healthy protein-rich lamb, salmon &amp; chicken , grain-free and gluten-free with no artificial colors, flavors or preservatives , rich in dietary fiber, iron and omega fatty acids , formulated for rotational feeding. unlike a conventional feeding plan where the same food is served at each meal, rotational feeding involves varying the menu , with added zinc, copper and iron "
650,50.7,9.75,canine caviar 97% brushtail grain-free  supplement,Canine Caviar,Canine Caviar,5,3,pate,108514," low grain, zero carb gourmet dog food made with ahi tuna, brown rice, hand-diced carrots, whole scrambled eggs, tiger prawns and other nutritious whole food ingredients , ahi consommé is great for adding extra moisture to your dog's diet and helps mimic a biologically appropriate diet , starch and flour free, zero glycemic index , high in protein and suitable for all life stages , ahi tuna is highly palatable, rich in essential omega fatty acids, and beneficial for dogs suffering protein allergies, also helps with skin and coat repair "
651,18.05,2.625,canidae grain-free pure petite escalloped style dinner with salmon & shrimp small breed dog food trays,CANIDAE,CANIDAE,3,1,pate,108454," turkey is the first listed ingredient. made with your pet's wellbeing in mind, this product is produced with no by-products. give your pet the best she deserves!  , this product is perfect for all life stages. puppies adult and senior dogs will thrive on this by-product free food. contains taurine for healthy eyes and heart. , provides all the vitamins, minerals and other essential nutrients that your pup will need to stay healthy. specially formulated to be a complete and balanced diet that your pet will love! , prepared with some of the best ingredients around! there are no artificial flavors, colors, preservative, sweeteners or sugars. , made to quality standards here in the usa! "
652,28.99,0.825,purina beyond simple origins grain-free free-range chicken & pea recipe ground entree dog food,Purina Beyond,Purina,,,minced,135620," specially designed for small breeds, this highly palatable recipe will have your pup begging for more. , features protein from turkey and chicken to give your pooch the energy he needs to be active. , designed to help digestibility, reduce shedding, promote a shinier coat, increase energy, strengthen nails and support healthier skin. , made without any corn, wheat, soy, by-products, artificial colors or preservatives, for a grain-free recipe you can trust. , proudly made in the usa from the earth’s best ingredients. "
653,34.68,9.75,party animal blazin' beef recipe grain-free ,Party Animal,Party Animal,4.3,10,pate,88809," features a hearty ground texture with an irresistible taste of chicken that dogs will devour. , balanced recipe provides complete nutrition and is highly digestible for easy nutrient absorption. , optimal levels of oil and minerals nourish the skin and coat for a luxurious shine. , soft texture adds flavor and variety to dog’s diets. serve it alone or mix it with kibble. , proudly made in the usa with the flavors dogs crave and the nutrition they need. "
654,25.08,0.825,castor & pollux organix tiny feasts grain-free organic turkey recipe dog food trays,Castor & Pollux,Castor & Pollux,,,pate,131171," features hearty cuts of real meat in gravy for an irresistible taste of beef and barley. , balanced recipe provides complete nutrition and is highly digestible for easy nutrient absorption. , optimal levels of oil and minerals nourish the skin and coat for a luxurious shine. , soft texture adds flavor and variety to dog’s diets. serve it alone or mix it with kibble. , proudly made in the usa with the flavors dogs crave and the nutrition they need. "
655,48.87,9.75,"bravo! canine cafe 95% rabbit,pork & liver dinner grain-free ",Bravo!,Bravo!,5,1,shredded,92944," made with the wholesome ingredients of beef and vegetables, consisting of carrots and also potatoes , included minerals and vitamins help guarantee that your pet obtains the wholesome nourishment it needs , feel confident feeding this superior natural food with a delicious natural flavor , healthy, balanced meal for everyday feeding , made in the usa! "
656,33.48,9.75,redbarn naturals duck & turkey pate high protein grain-free ,Redbarn,Redbarn,5,1,pate,88177," natural canned dog food recipe made with real beef &amp; vegetables, with no meat by-products, artificial colors or flavors added , formula contains added vitamins and minerals to make this a complete and balanced meal for adult dogs with all the nutrition they need for a happy lifestyle , contains an optimal balance of protein, fat and carbohydrates , recipe contains premium, wholesome ingredients that are sure to make your dog wag their tail with delight at mealtime , made in the usa! "
657,26.13,9.9,evolve nature's menu mountain range medley with salmon & venison in sauce ,Evolve,Evolve,4.3,3,chunks in gravy,79772," natural canned dog food recipe made with real lamb &amp; vegetables, with no meat by-products, artificial colors or flavors added , formula contains added vitamins and minerals to make this a complete and balanced meal for adult dogs with all the nutrition they need for a happy lifestyle , contains an optimal balance of protein, fat and carbohydrates , recipe contains premium, wholesome ingredients that are sure to make your dog wag their tail with delight at mealtime , made in the usa! "
658,44.28,9.9,"go! fit + free grain-free chicken,turkey & trout stew ",Go!,Go!,4.7,7,stew,63555," 92% of the ingredients come from lamb, chicken and pork for a protein-rich and fuel-filled variety your dog will love. , made without corn, soy or chicken by-product and formulated to be high in protein, this meal keeps your dog full and happy. , provides the fuel necessary to bolster aerobic capacity while ensuring long-term energy. , made with absolutely no artificial colors, flavors or preservatives. this high-quality food is produced in nutro's own facilities to ensure safety and quality. , nutro's dedicated team of experts tailor their formulas to your pet's life stage and health condition. they only use natural ingredients that they directly buy and can trace back to their suppliers. "
659,18.77,9.9,hi-tor veterinary select reduso diet ,HI-TOR,HI-TOR,4,2,pate,51040," made from high-quality lamb , 100% animal protein, this diet is an ancestrally appropriate carnivore diet , fortified with vitamins and minerals , free of soy, grains and glutens, no artificial preservatives, colors or flavors , wholesome meat with no added carbohydrates "
660,28.99,0.825,"purina beyond simple origins grain-free free-range chicken,wild alaskan salmon & spinach recipe ground entree dog food",Purina Beyond,Purina,,,minced,135622," perfect for pets with common protein allergies , ideal for protein rotation, served as a unique treat or you can add to your pet’s dry food as an irresistible topper , cold processed to give your pup the best nutritional value and makes an easy-to-feed raw alternative , it’s full of omega fatty acids for skin and coat health , no grains, fillers, added sugar, added salt, or artificial colors or preservatives "
661,21.43,0.825,halo salmon recipe grain-free puppy ,Halo,Halo,,,pate,133087," escalloped style dinner with salmon and shrimp for finicky small dogs. , simple, limited ingredient recipe is great for sensitive eaters. , comes in convenient single-serving trays for less mess and leftovers. , nutritious recipe is made without corn, wheat, soy or carrageenan. , made with uncompromising quality in the usa by the family-owned company. "
662,21.43,0.825,halo chicken recipe grain-free puppy ,Halo,Halo,,,pate,133085," made with ground free-range chicken as the first ingredient for the simple, high-protein diet dogs thrive on. , loaded with vitamins, minerals and antioxidants to support overall health, and accented with wholesome veggies like peas. , formulated by pet nutritionists using only natural ingredients with no corn, wheat, soy, fillers, artificial colors, flavors or preservatives. , provides a complete and balanced meal for adults dogs, on its own or as a delicious kibble topper. , made in usa facilities with high-quality, honestly-sourced non-gmo ingredients so you know the whole story behind your pup’s food. "
663,59.88,9.75,k9 natural grass-fed lamb feast grain-free ,K9 Natural,K9 Natural,5,3,pate,104988," produced with fresh top-quality poultry, seafood and meats, which provides a healthy source of protein for your pet , also use fresh fruits and vegetables such as blueberries, cranberries, zucchini and artichoke to name a few, which are a great source of antioxidants, fiber, vitamins and folic acid , formulated to promote clean nutrition and protection for your pets from exposure to toxins and unhealthy ingredients , made with organic beef, fruits, vegetables, vitamins &amp; minerals for overall wellbeing , no corn, soy, or wheat gluten "
664,31.08,9.75,dave's pet food stewlicious grain-free chunky chicken stew ,Dave's Pet Food,Dave's Pet Food,4.7,3,stew,99503," small breed formula is made with organic turkey as the first ingredient plus chicken broth, spinach, peas, flaxseeds and cranberries. , provides a complete and balanced diet for petite pups of all ages with vitamins, minerals, and antioxidants. , can be given as a meal on its own or used to top dry kibble to delight even the pickiest pups. , cooked in organically certified kitchens in the usa with no soy, corn, gluten, antibiotics, hormones, artificial flavors, colors or preservatives. , comes in easy to open peel-tab cups that make portion control easy and mess-free. "
665,33.48,9.75,redbarn naturals beef pate puppy grain-free ,Redbarn,Redbarn,4,1,pate,88179," features delicious cuts of rabbit, pork and pork liver , made with green beans, cranberries, salmon oil, green lipped mussels, garden greens and turmeric , grain &amp; gluten-free, complete and balanced for all life stages , natural recipe with added vitamins and minerals , no artificial preservatives, flavors or colors, guar gum, carrageenan or cassia gums "
666,40.68,9.75,petkind that's it! bison tripe grain-free ,PetKind,PetKind,4.3,17,pate,71116," high-quality chicken is the #1 ingredient in this complete and balanced adult food with added vitamins and minerals. , there's no grains, glutens, corn, wheat, or soy, so it's great for pet parents who are concerned with allergies, obesity, or digestibility. , added salmon oil is naturally rich in omega fatty acids which support healthy skin, coat, and joints. , absolutely no carrageenan, artificial colors, flavors, or preservatives, no you can be confident you're feeding your pup the best. , made in the usa! "
667,28.68,9.9,precise holistic complete pork with vegetables formula in gravy grain-free ,Precise Holistic Complete,Precise Holistic Complete,4,8,pate,51109," chunks in gravy canned food made with chicken, fish, peas and vegetables, while also containing salmon and venison in a savory sauce. , added vitamins and minerals ensure your dog gets the nutrition he needs. , made in the usa by the family-owned sunshine mills, inc. , every batch of food is certified for food safety. , the hearty stew recipe is a smart start to the healthy life of your dog. "
668,9.75,0.825,pedigree chopped meaty ground dinner with slow cooked beef wet dog food,Pedigree,Pedigree,,,minced,114367," prepared with premium-quality chicken, turkey &amp; trout along with fruits, veggies and omega oils , antioxidants to support increased immunity , omega oils for healthy skin and coat , zero by-product meals, added growth hormones or artificial preservatives , zero beef, wheat, corn or soy "
669,16.99,2.625,under the sun grain-free with lamb & carrots in gravy dog food trays,Under the Sun,Under the Sun,,,chunks in gravy,108467," formulated for the dietary management of overweight adult dogs , it has fewer digestible calories than regular dog food , great for the maintenance of adult dogs , highly palatable, and has no artificial flavors or colors , formulated to minimize stress and irritation of the gastrointestinal tract "
670,28.68,9.9,health extension grain-free tasty turkey stew ,Health Extension,Health Extension,5,1,stew,102051," made with ground free-range chicken as the first ingredient plus salmon for the simple, high-protein diet dogs thrive on. , loaded with vitamins, minerals and antioxidants to support overall health, and accented with wholesome veggies like spinach. , formulated by pet nutritionists using only natural ingredients with no corn, wheat, soy, fillers, artificial colors, flavors or preservatives. , provides a complete and balanced meal for adults dogs, on its own or as a delicious kibble topper. , made in usa facilities with high-quality, honestly-sourced non-gmo ingredients so you know the whole story behind your pup’s food. "
671,40.92,9,"tiki dog gourmet carnivore beef,liver & lamb grain-free ",Tiki Dog,Tiki Dog,4.8,4,sliced,78916," sustainably-caught, wild salmon is the very first ingredient in this savory canned food that also includes turkey liver and eggs. , wholesome, non-gmo parsley, blueberries, cranberries and raspberries provide essential antioxidants, fiber and vitamins for your growing dog. , complete and balanced nutrition is fortified with essential minerals and trace nutrients to support healthy development. , made in the usa with no grains, meat-meals, hormones or antibiotics, as well as no artificial colors, flavors or preservatives; packed in bpa-free cans for safety. , smooth, delicious texture provides additional hydration and can be used as a delicious topper over dry kibble to entice a picky eater. "
672,26.99,9.75,dogswell vitality duck & sweet potato stew recipe grain-free ,Dogswell,Dogswell,4.3,7,stew,47137," sustainably-raised, cage-free chicken is the very first ingredient in this savory canned food that also includes chicken liver and eggs. , wholesome, non-gmo parsley, blueberries, cranberries and raspberries provide essential antioxidants, fiber and vitamins for your growing dog. , complete and balanced nutrition is fortified with essential minerals and trace nutrients to support healthy development. , made in the usa with no grains, meat-meals, hormones or antibiotics, as well as no artificial colors, flavors or preservatives; packed in bpa-free cans for safety. , smooth, delicious texture provides additional hydration and can be used as a delicious topper over dry kibble to entice a picky eater. "
673,10.8,0.825,purina bella grilled top sirloin flavor in savory juices small breed dog food trays,Purina Bella,Purina,,,pate,135831," all of the wholefood ingredients are sourced in new zealand, are of  high-quality and can be traced back to the farm , absolutely no grain, gluten, gmo, dairy, rice, potato or fillers , hearty iron-packaged meal that's made up of 90% high quality grass-fed, ranch raised lamb , k9 natural dog food that is a 100% natural, species-appropriate, nutritionally sound diet, based on the diet of your dogâ€™s closest relative, the wolf , new zealand green lipped mussels and essential vitamins, minerals and oils are added for better overall health "
674,13.99,0.825,pedigree chopped ground dinner with chopped liver & beef ,Pedigree,Pedigree,,,minced,114363," great for sensitive pets and provides a wholesome and nutritious meal , hearty stew with tons of chicken creates a nutritious stew that’s cooked just for your dog , filled with vitamins and minerals delivering healthy food at a great value , no corn, wheat, soy or gluten, which means this wholesome meal is easier on the tummy and filled with more tasty meat , recipe combines mouthwatering chicken with sweet potatoes, carrots and peas "
675,16.99,2.625,under the sun grain-free with chicken and peas dog food trays,Under the Sun,Under the Sun,5,1,pate,108462," high-quality beef is the #1 ingredient in this complete and balanced puppy food with added vitamins and minerals. , there's no grains, glutens, corn, wheat, or soy, so it's great for pet parents who are concerned with allergies, obesity, or digestibility. , added superfoods support your pet's overall health. flaxseed oil which is rich in omega fatty acids promotes healthy skin and a shiny coat, while dandelion greens help with digestion. , absolutely no carrageenan, artificial colors, flavors, or preservatives, no you can be confident you're feeding your pup the best. , made in the usa! "
676,59.88,9.375,caru real pork stew grain-free wet dog food,Caru,Caru,4.5,6,stew,85711," this grain and gluten-free, limited ingredient food is crafted from only 5 ingredients. it's prefect for pets that have sensitivities or allergies to common foods. , it's highly palatable and packed with quality ingredients like quinoa and blueberries for an antioxidant boost. it doesn't contain gums, binders, or fillers, so you can feel confident about feeding your loved one. , perfect to add to a raw diet, or top a dry kibble with. tripe helps to promote cleaner teeth, a healthy, lustrous skin and coat, and can help put a spring back in your elderly dog's step. , a great option for those picky eaters who get bored easily. adding a little bit of petkind's bison tripe introduces a new protein to your pup's diet and helps switch things up. , made in the usa! "
677,18.32,4,earthborn holistic lily's gourmet buffet grain-free natural moist dog food,Earthborn Holistic,Earthborn Holistic,4.7,26,minced,52816," this complete and balanced dog food with added vitamins and minerals has been formulated for growth and maintenance of puppies and adult dogs. made with quality protein like real pork, turkey and vegetables for a taste your pup will love. , it's grain-free and there's no corn, wheat, or soy, so a it's a perfect option for pet parents who are concerned about allergies, obesity, and digestibility.  , chelated minerals are included which are more easily absorbed by the body and provide the correct balance of daily mineral requirements. added rosemary and turmeric, which are natural antioxidants, help to fight free radicals in the body. , included chamomile, dandelion, and peppermint are natural digestive aids and cranberries and blueberries provide a natural source of antioxidants to promote health and vitality. , made in the usa! "
678,30.63,9,evanger's signature series slow cooked chicken stew grain-free ,Evanger's,Evanger's,3.7,15,stew,52640," features a meaty ground texture with an irresistible taste of beef in easy-tear pouches. , balanced recipe provides complete nutrition and is highly digestible for easy nutrient absorption. , optimal levels of oil and minerals nourish the skin and coat for a luxurious shine. , soft texture adds flavor and variety to dog’s diets. serve it alone or mix it with kibble. , proudly made in the usa with the flavors dogs crave and the nutrition they need. "
679,30,0.825,"solid gold love at first bark chicken,potatoes & apples puppy recipe grain-free ",Solid Gold,Solid Gold,5,1,pate,133729," tender lamb and carrots pate is slow-cooked to perfection. , great as a meal on its own or as a delicious topper to kibble. , potato and grain-free recipe includes vitamins and minerals. , comes in convenient, single-serving 3.5 ounce trays for less mess and leftovers. , made in the usa with uncompromising quality by the family-owned company. "
680,59.88,9.75,k9 natural grass-fed beef feast grain-free ,K9 Natural,K9 Natural,5,1,pate,104981," a delicious recipe that provides complete and balanced nutrition for all life stages , gluten-free and grain-free, with no rendered animal fats or by-products, no added sugar, no carrageenan, and no corn, wheat, or soy , super palatable: your pup will go crazy for the taste and texture of this chunky, hearty stew , fortified with vitamins, minerals, rich fruits and vegetables, this recipe provides essential moisture to prevent dehydration and help maintain proper urinary tract health , convenient, easy to open pull-tab can makes meal time quick and easy "
681,56.28,9.375,lotus venison stew grain-free ,Lotus,Lotus,4.2,4,stew,101889," gourmet dog food recipe made with hand diced beef liver and beef lung combined with shredded lamb, beef and lamb are then simmered in a beef consommé broth made in a traditional stock method to produce naturally occurring flavors and then olive oil, vitamins and minerals are added , grain and gluten-free recipe that is also carbohydrate, starch and flour free , made with whole meats and contains 55% protein, 35% fat and 0% carbs , zero glycemic index , great for all life stages, helps dogs consume more moisture and mimics a biologically appropriate diet "
682,34.48,0.825,royal canin urban life puppy ,Royal Canin,Royal Canin,,,pate,88008," chunks of cage-free duck with antioxidant-rich fruits and veggies in a delicious sweet potato stew that's sure to please your pup , antioxidant-rich fruits &amp; veggies, like berries and spinach support overall health and wellness, while veterinarian-selected botanicals help support metabolism, strengthen organs and cleanse the body of toxins , fiber rich pumpkin and prebiotics help to support proper digestion while chelated minerals offer better nutrient absorption , crafted without grains, corn, wheat, and soy, so it's a great option for pet parents that are concerned with obesity, digestibility, and allergies , made in the usa!  "
683,26.13,9.9,"evolve nature's menu holiday harvest with turkey,duck & cranberries in gravy ",Evolve,Evolve,4.4,12,chunks in gravy,79770," formulated for small dogs with high-protein chicken and liver in savory juices naturally flavored with grilled top sirloin. , super premium wet dog food is loaded with immune-boosting antioxidants, muscle-nourishing protein, vitamins and minerals. , provides a 100% complete and balanced diet for adult small breeds, and is higher in nutrients for small dogs’ higher metabolisms. , single-serve, easy-to-open trays make mealtime a cinch and can be given on their own or as a delicious meal topper for kibble. , produced in usa facilities with careful safety and quality checks to guarantee the best ingredients for your pampered pooch. "
684,30.63,9,evanger's signature series slow cooked turkey stew grain-free ,Evanger's,Evanger's,3.6,10,stew,52642," features a hearty chopped texture with an irresistible taste of liver and beef. , balanced recipe provides complete nutrition and is highly digestible for easy nutrient absorption. , optimal levels of oil and minerals nourish the skin and coat for a luxurious shine. , soft texture adds flavor and variety to dog’s diets. serve it alone or mix it with kibble. , proudly made in the usa with the flavors dogs crave and the nutrition they need. "
