,price,weight,product_list,maker,brand,rating,review_cnt,foodtexture,id,benefits
343,8.16,0.825,"alpo prime cuts with turkey & bacon in gravy ,13.2-oz,case of 12",ALPO,ALPO,4.6,8,chunks in gravy,100074," all natural grain-free &amp; gluten-free recipe for cats and dogs featuring a single source protein from high quality rabbit , contains no corn, wheat, soy, preservatives or fillers , intended for intermittent or supplemental feeding only. great for protein rotation and as a topper for evanger's dry food diets , endorsed by the crc kosher for passover , made in the usa! "
344,17.49,9.75,chicken soup for the soul adult ,Chicken Soup,Chicken Soup,4.7,78,pate,91711," precisely balanced nutrition to help build immunity and mobility , high-quality protein to promote ideal body weight , promotes gentle and healthy digestion with balanced and complete nutrition , this delicious formula promotes gentle and healthy digestion and has a savory meaty taste your puppy will love , recommended for puppies up to 1 year old and pregnant or nursing dogs "
345,7.99,0.825,purina one smartblend true instinct tender cuts in gravy variety pack ,Purina ONE,Purina,4.9,13,chunks in gravy,111092," natural, limited ingredient diet for dogs with food sensitivities or food allergies , high-quality turkey as the first ingredient , does not contain grains, gluten or wheat , easily-digestible formula with probiotics and prebiotics , nourishes healthy skin with flaxseed "
346,30.02,0.825,nutro adult petite eats roasted turkey & vegetable entree cuts in gravy dog food trays,Nutro,Nutro,4.8,29,stew,86755," this meaty chunk, savory blend is full of real ingredients you can see, like lamb and veggies served with a touch of sauce , made to break apart easily, so even the tiniest pups and even senior dogs can enjoy this scrumptious meal without trouble , features a delicate taste and a delightful texture even the pickiest of dogs will love! , fortified with vitamins and minerals for overall wellness , it’s all packed into a convenient tub that you can use to store uneaten portions for tomorrow’s dinner "
347,32.99,9.375,wellness complete health chicken & sweet potato formula ,Wellness,Wellness,4.6,48,pate,49201," tender chunks of meat in gravy, every dog will love! , made with high-quality protein sources , contains 25% more protein than the leading canned competitor’s adult dog food , fortified with 23 vitamins and minerals for overall well-being , 100% complete and balanced for adult dogs "
348,23.59,9.75,"natural balance original ultra whole body health reduced calorie chicken,salmon & duck formula ",Natural Balance,Natural Balance,4.4,69,pate,47996," formulated to feature premium nutrition so that your dog can stay happy, healthy, and well , slow cooked to lock in all of the natural goodness and flavor without losing any of the nutrients , features antioxidants such as zinc, vitamin e, and selenium to help promote overall health &amp; vigor , antioxidants to promote a healthy immune system and overall health , omega fatty acids help promote a healthy and shiny coat "
349,36.99,9.975,purina pro plan veterinary diets ur urinary ox/st ,Purina Pro Plan Veterinary Diets,Purina,4.9,38,minced,87806," variety pack of recipes inspired by the nutrient-dense foods in nature in great-tasting gravy. , complete and balanced nutrition formulated with real meat plus vitamins and minerals. , includes two times the recommended antioxidant levels with zinc, selenium, and vitamins a and e. , highly palatable and digestible so more nutrients go to work inside your dog. , includes 3 cans of real turkey &amp; venison and 3 cans of real chicken &amp; duck. "
350,14.64,4,rachael ray nutrish natural savory lamb stew natural wet dog food,Rachael Ray Nutrish,Rachael Ray Nutrish,4.7,30,chunks in gravy,55411," made with real turkey for a great taste even finicky dogs will enjoy, in easy-to-serve trays. , complete nutrition is crafted just for small dogs and rich with essential nutrients. , optimal levels of linoleic acid and zinc help support healthy skin and a shiny coat. , natural ingredients are carefully sourced from a trusted network of farmers and suppliers. , made in the usa with no chicken by-product meal, soy or artificial flavors or preservatives. "
351,7,4.125,mighty dog porterhouse steak flavor & tenderloin tips flavor in gravy variety pack ,Mighty Dog,Mighty Dog,4.5,19,chunks in gravy,100684," delicious pate made with quality proteins, including premium chicken , b12 supplement assists gastrointestinal function , contains easily-digested proteins , high in antioxidants , complete and balanced for everyday feeding "
352,5.94,0.825,"royal canin chihuahua adult ,3.5-oz,pack of 4",Royal Canin,Royal Canin,4.6,27,pate,99656," a high quality, gluten free and reduced calorie diet that’s made with multiple animal protein sources , yucca schidigera extract aids gastrointestinal system and reduces odor in stool , this unique blend of food is highly digestible allowing for maximum nutrient absorption , added vitamins like vitamin a and vitamin b12 help support a healthy immune system , made with antioxidant nutrients and minerals for optimal brain health "
353,14.04,0.825,pedigree chopped ground dinner with chicken ,Pedigree,Pedigree,4.9,15,minced,114358," purina pro plan veterinary diets ur urinary ox/st has been specifically formulated to promote urinary tract health by promoting a urinary environment unfavorable for developing struvite and calcium oxalate crystals. , promotes the production of urine that is under saturated for struvite crystals and metastable for calcium oxalate crystals, based on rss and apr tests , formulated with high protein and low carbohydrate levels. , designed for dogs with lower urinary tract disease, sterile struvite stones, a history of calcium oxalate stones, or idiopathic cystitis. , made in the usa! "
354,18.61,0.825,"purina beneful chopped blends with salmon,sweet potatoes,brown rice & spinach wet dog food,10-oz container,case of 8",Purina Beneful,Purina,4.7,20,shredded,100028," natural food with added vitamins and minerals providing your pup with complete and balanced nutrition. , made with real lamb, brown rice, and vegetable accents like carrots and spinach. , there's no glutens, corn, wheat, or soy, so it's great for pet parents who are concerned with allergies, obesity, or digestibility. , there's no meat by-products or fillers, so you can be confident in feeding your loved one. , there also aren't artificial flavors, colors, or preservatives, just simple natural ingredients. "
355,25.99,9.375,blue buffalo basics limited ingredient grain-free turkey & potato senior ,Blue Buffalo,Blue Buffalo,4.9,23,pate,88193," this special recipe features a tempting steak-inspired meals that are made just for small dogs , specially formulated for small dogs, little pups need more protein to keep them going strong all day, and this dish is packed with it , features a full range of amino acids, vitamins and minerals to meet his unique nutritional needs , formulated to meet the nutritional levels established by the association of american feed control officials (aafco) dog food nutrient profiles for growth of puppies and maintenance of adult dogs , made without any added artificial preservatives "
356,13.99,0.825,blue buffalo divine delights prime rib flavor hearty gravy dog food trays,Blue Buffalo,Blue Buffalo,5,6,chunks in gravy,114291," complete and balanced for purebred chihuahuas , supports digestive health and intestinal transit , select ingredients support skin and coat health , makes the perfect complement to chihuahua adult dry formula , highly palatable to satisfy finicky appetites "
357,10.68,9.9,pedigree choice cuts in gravy country stew ,Pedigree,Pedigree,4.6,14,"stew, chunks in gravy",114176," features a hearty chopped texture with an irresistible taste of ground chicken. , balanced recipe provides complete nutrition and is highly digestible for easy nutrient absorption. , optimal levels of oil and minerals nourish the skin and coat for a luxurious shine. , soft texture adds flavor and variety to dog’s diets. serve it alone or mix it with kibble. , proudly made in the usa with the flavors dogs crave and the nutrition they need. "
358,13.41,0.825,"purina beneful prepared meals beef & chicken medley with green beans,carrots & wild rice wet dog food",Purina Beneful,Purina,4.7,10,stew,100163," this finely chopped, savory blend is full of real ingredients you can see, like salmon, sweet potatoes, brown rice and spinach served with a touch of sauce , made to break apart easily, so even the tiniest pups and even senior dogs can enjoy this scrumptious meal without trouble , features a delicate taste and a delightful texture even the pickiest of dogs will love! , fortified with vitamins and minerals for overall wellness , it’s all packed into a convenient tub that you can use to store uneaten portions for tomorrow’s dinner "
359,14.64,4,rachael ray nutrish natural beef stroganwoof natural wet dog food,Rachael Ray Nutrish,Rachael Ray Nutrish,4.2,32,chunks in gravy,81480," contains turkey, a high-quality protein not typically used in dog food and potatoes, an easily digestible carbohydrate source , a precise blend of veggies, fruit and micronutrients - these ingredients were selected for their nutritional value and their capacity to help in the digestive process , an optimal blend of omega 3 &amp; 6 fatty acids helps maintain the immune system and support skin and coat health , contains no chicken (or poultry) by-product meals, artificial ingredients of any kind, or corn, wheat, soy, dairy or eggs - ingredients known to cause allergies in some dogs , made without grains that contain glutens some pet parents choose to avoid "
360,24.03,9.375,blue buffalo freedom adult beef recipe grain-free  ,Blue Buffalo,Blue Buffalo,4.7,24,pate,84146," specially prepared for small dogs with meaty chunks in a savory sauce in single-serving trays.  , real, deboned beef is the first ingredient with added vitamins and minerals. , inspired by a naturally wild diet, this protein-rich recipe caters to your dog’s inner carnivore. , made in the usa with only real ingredients and never any chicken or poultry by-product meals.  , completely free of corn, wheat or soy or artificial preservatives, colors or flavors. "
361,18.72,2.625,merrick lil' plates grain-free teeny texas steak tips in gravy dog food trays,Merrick,Merrick,4.6,33,stew,102310," features hearty cuts of real meat in gravy for an irresistible taste of country stew. , balanced recipe provides complete nutrition and is highly digestible for easy nutrient absorption. , optimal levels of oil and minerals nourish the skin and coat for a luxurious shine. , soft texture adds flavor and variety to dog’s diets. serve it alone or mix it with kibble. , proudly made in the usa with the flavors dogs crave and the nutrition they need. "
362,33.99,9.75,hill's prescription diet g/d aging care turkey flavor ,Hill's Prescription Diet,Hill's,4.7,32,pate,69757," this meaty chunks, savory blend is full of real ingredients you can see with a touch of sauce , made to break apart easily, so even the tiniest pups and even senior dogs can enjoy this scrumptious meal without trouble , features a delicate taste and a delightful texture even the pickiest of dogs will love! , fortified with vitamins and minerals for overall wellness , it’s all packed into a convenient tub that you can use to store uneaten portions for tomorrow’s dinner "
363,20.04,9.75,natural balance ultra premium liver formula ,Natural Balance,Natural Balance,4.8,64,pate,48014," natural food with added vitamins and minerals providing your pup with complete and balanced nutrition. , made with real beef and chicken, and with vegetable accents of greens beans and tomatoes. , there's no glutens, corn, wheat, or soy, so it's great for pet parents who are concerned with allergies, obesity, or digestibility. , there's no meat by-products or fillers, so you can be confident in feeding your loved one. , there also aren't artificial flavors, colors, or preservatives, just simple natural ingredients. "
364,21.49,0.825,nutro adult kitchen classics grass fed lamb & brown rice ,Nutro,Nutro,4.3,25,pate,86738," wholesome natural ingredients like peas, carrots, blueberries and cranberries , chelated minerals boost the immune system and biotin keeps the skin and coat healthy , made without wheat, a common allergy trigger for dogs, great for dogs with sensitive digestive systems , a sensible alternative to less convenient raw diets, which often require additional supplementation to be nutritionally complete , vitamin b12 boosts energy and improves gastrointestinal function "
365,21.24,9.525,whole earth farms grain-free hearty chicken stew ,Whole Earth Farms,Whole Earth Farms,4.5,81,stew,73957," convenient, single-serve trays for small breeds , rich in animal protein and 100% grain-free , no artificial colors, flavors or preservatives , contains antioxidants for immune system health , omega 3 and 6 fatty acids nourish skin and coat "
366,8.38,2.625,cesar classics pate beef multipack dog food trays,Cesar,Cesar,4.9,27,pate,86450," clinical nutrition especially formulated to support your older dog's kidneys and heart for overall health , reduced phosphorus helps minimize stress on aging kidneys and reduced sodium helps maintain normal blood pressure , reduced protein and targeted levels of high quality protein help decrease kidney workload , optimal fat levels to reduce pancreatic workload , increased levels of omega-3 fatty acids and controlled calories support kidney health "
367,28.99,9.375,blue buffalo family favorite grain-free recipes backyard bbq ,Blue Buffalo,Blue Buffalo,4.8,30,stew,84997," a complete and balanced formula that’s perfect for all breeds and all ages, from puppies to adults , this unique blend of food is highly digestible allowing for maximum nutrient absorption , made with added vegetables such as dried kelp and carrots , added vitamins like vitamin a and vitamin b12 help support a healthy immune system , yucca schidigera extract aids gastrointestinal system and reduces odor in stool "
368,21.24,9.525,whole earth farms grain-free hearty turkey stew ,Whole Earth Farms,Whole Earth Farms,4.5,94,stew,73959," promotes healthy skin and a soft, shiny coat to keep your pet looking and feeling robust. , natural dog food offers complete nutrition that is rich in nutrients and full of flavor. , tasty recipe is also specially crafted to help support healthy digestion and full nutritional benefit. , natural ingredients like grass-fed lamb are carefully sourced from their trusted network of farmers and suppliers. , made in the usa with no chicken by-product meal, soy or artificial flavors or preservatives. "
369,33.99,9.375,"wellness core grain-free beef,venison & lamb formula ",Wellness,Wellness,4.5,93,pate,52021," the best, healthy ingredients from the earth, mixed into a delicious daily meal , protein rich chicken, blueberries, flavorful rosemary, sage and thyme are just a few of the nutritious ingredients , cooked in america with the earth's best ingredients , no corn, wheat or soy , no ingredients from china "
370,33.99,9.9,wellness 95% turkey grain-free ,Wellness,Wellness,4.7,77,pate,49199," high quality cuisine that provides unparalleled variety and enjoyment , formula provides complete and balanced nutrition in a pate formulated for adult dogs , fortified with vitamins and minerals to help dogs of all sizes to stay healthy , savory dog food is served in convenient trays with easy, peel-away freshness seals , features delectable delicious steak and filet mignon recipes for dogs with refined tastes at any time of day "
371,6.99,4.125,"mighty dog hearty beef dinner,chicken & smoked bacon combo & lamb & rice variety pack ",Mighty Dog,Mighty Dog,4.8,16,minced,100678," made without wheat, a common allergy trigger for dogs or artificial flavors, colors, or preservatives , chelated minerals boost the immune system and biotin keeps the skin and coat healthy , inspired by real backyard barbecues , wholesome natural ingredients like peas, green beans and potatoes , a sensible alternative to less convenient raw diets, which often require additional supplementation to be nutritionally complete "
372,21.99,0.825,nutro senior hearty stews grandpa's country stew with chicken & turkey chunks in gravy ,Nutro,Nutro,4.7,23,chunks in gravy,86751," the best, healthy ingredients from the earth, mixed into a delicious daily meal , protein rich turkey, blueberries, flavorful rosemary, sage and thyme are just a few of the nutritious ingredients , cooked in america with the earth's best ingredients , no corn, wheat or soy , no ingredients from china "
373,17.64,9.375,purina beyond turkey & green bean recipe in gravy grain-free ,Purina Beyond,Purina,4.8,25,chunks in gravy,93786," grain and gluten-free formula that is also fish-free , contains 6 protein sources, with 50% more protein than wellness chicken &amp; sweet potato formula , includes greens and botanicals for optimum health , only premium, all natural ingredients with no wheat, corn, soy, meat by-products, or artificial colors, flavors and preservatives , complete and balanced for everyday feeding "
376,39.49,9.375,hill's prescription diet metabolic weight management vegetable & beef stew ,Hill's Prescription Diet,Hill's,4.7,32,stew,87468," grain-free formula perfect for pups with sensitive stomachs , made with all-natural, premium turkey , perfect dry food topper or kibble mix , taurine supports a healthy heart , a delicious way to add more protein and variety "
377,27.99,0.825,cesar classics in meaty juices variety pack dog food trays,Cesar,Cesar,5,9,pate,128536," a hearty, delicious meal with a finely ground texture that’s tailored to a small dog’s needs , specially formulated for small dogs, little pups need more protein to keep them going strong all day, and this dish is packed with it , features a full range of amino acids, vitamins and minerals to meet his unique nutritional needs , formulated to meet the nutritional levels established by the association of american feed control officials (aafco) dog food nutrient profiles for growth of puppies and maintenance of adult dogs , made without any added artificial preservatives "
379,19.38,0.825,instinct by nature's variety grain-free chicken formula ,Instinct,Instinct,4.7,84,pate,120819," tasty and clean recipe is specially formulated with nutrient and energy levels for senior dogs. , naturally sourced glucosamine and chondroitin to support healthy joints and mobility. , optimal levels of linoleic acid and zinc support healthy skin and coat and natural fibers support healthy digestion. , natural ingredients like real chicken are carefully sourced from a trusted network of farmers and suppliers. , made in the usa with no chicken by-product meal, soy or artificial flavors or preservatives. "
380,23.88,9.75,canidae life stages chicken & rice formula ,CANIDAE,CANIDAE,4.8,65,pate,47023," this chucky style adult dog food is made with real turkey and chicken. vitamins and minerals are added to make this a complete and balanced meal so your pup can live a long, healthy life. , there's no grains, glutens, corn, wheat or soy so it's a great option for pet parents that are concerned with allergies, obesity and digestibility. , quality protein is found in this formula and there's no poultry by-product meal, added artificial colors, flavors, or preservatives so you can feel confident about feeding your loved one. , accented with green beans for a vitamin and mineral boost. , made in the usa! "
381,18.96,9.75,purina pro plan savor adult turkey & vegetables entree slices in gravy ,Purina Pro Plan,Purina,4.6,30,chunks in gravy,67640," five or more full-size goodies from premium brands, including some grain- and gluten-free options. , free shipping on every chewy goody box order! , handpicked gifts for small dogs, from puppy to senior. , great savings on everyday prices on this selection of toys and treats. , makes a great gift for your own small pup, but you can also surprise your pet parent friends with a cute pet gift box for any special occasion, holiday or even puppy shower! , it’s great for special occasions, new pet adoptions, pet birthdays or a special present for any day of the year. "
382,25.99,9.375,nutro ultra large breed adult chunks in gravy ,Nutro Ultra,Nutro,4.6,15,chunks in gravy,48402," suitable for adult dogs 1 year and older , a delicious classic pate made with high-quality animal proteins plus vitamins and minerals , wholesome dog food that is formulated with omega fatty acids to promote healthy skin and a soft coat , made with natural ingredients, is slow-cooked in real broth for a taste dogs can't resist , contains vitamin e to support a strong immune system "
383,21.24,9.525,whole earth farms grain-free hearty salmon stew ,Whole Earth Farms,Whole Earth Farms,4.6,53,stew,87363," developed and specially formulated to support your dog's weight management with a synergistic blend of ingredients , naturally works with your pet's individual metabolism with a unique fiber blend from fruits and vegetables , helps avoid weight regain after weight loss and keeps your pet feeling full and satisfied between meals , developed with a unique fiber blend from fruits and vegetables to keep your pet at the optimal weight. in fact, 88% of pets lost weight at home in 2 months , supports vitality and holistic health with powerful antioxidants "
384,31.44,9.9,merrick classic grain-free venison holiday stew recipe ,Merrick,Merrick,4.7,75,chunks in gravy,47884," gourmet variety pack includes grilled chicken, filet mignon, porterhouse steak, beef, chicken and liver, and turkey. , enhanced with essential vitamins and minerals for a complete, balanced diet. , perfect for small to large dogs as complete meals or tasty dry food toppers. , mouth-watering flavors and textures are irresistible even for the pickiest eaters. , convenient single-serve trays with easy peel-away freshness seals to make mealtime easy. "
385,13.52,0.825,"purina beneful prepared meals chicken stew with rice,carrots,peas & barley wet dog food",Purina Beneful,Purina,4.9,13,stew,100169," pate-style dog food made from natural ingredients that are slow-cooked in real broth. , great when served on its own or as an irresistible topper to your dog’s kibble. , added vitamins and minerals offer complete and balanced nutrition for adult dogs. , omega fatty acids promote a healthy coat and skin, and vitamin e boosts immunity. , a customized mix of protein and carbs contribute to healthy energy levels. "
386,30.02,0.825,nutro adult petite eats signature beef & potato entree cuts in gravy dog food trays,Nutro,Nutro,4.7,34,stew,86740," formulated to mirror your dog’s ancestral diet with 95% chicken, turkey and liver, plus 5% vegetables, fruits, and wholesome ingredients, and 0% grain and gluten.  ,  natural ingredients with added vitamins and minerals provide complete and balanced nutrition for all life stages and breeds.  ,  includes healthy omega fatty acids to promote a soft and shiny coat.  ,  delicious loaf texture comes in a variety of proteins that can be rotated to bring your dog great-tasting variety at the bowl.  ,  made in usa facilities with no grain, gluten, corn, wheat, soy or fillers or artificial colors, flavors or preservatives.  "
387,21.49,0.825,"nutro adult kitchen classics slow cooked chicken,rice & oatmeal dinner ",Nutro,Nutro,4.7,43,pate,86747," vet formulated for all breeds, ages and sizes to take the guesswork out of choosing your food. , made with nutritionally dense chicken as the first ingredient for optimum protein. , premium ingredients plus added vitamins and minerals make for great-tasting nutrition. , simmered in a broth for an irresistible flavor that dogs love. , made with uncompromised quality by the family-owned company without corn, wheat or soy. "
388,22.13,9.375,"hill's science diet adult healthy cuisine braised beef,carrots & peas stew ",Hill's Science Diet,Hill's,4.8,12,stew,94006," 100% complete and balanced diet specifically formulated to support a healthy, active lifestyle for adult dogs , savory entrée packed with real turkey and vegetables smothered in gravy provides the ultimate texture, taste, and nutrition your dog craves , powerful antioxidants support a strong immune system and optimal protein and fat levels help to promote an ideal body composition , omega-6 fatty acids are included to maintain healthy skin and a beautiful shiny coat , proudly manufactured in purina-owned u.s.a facilities and does not contain any added artificial colors, flavors, or preservatives "
